{
  "version": 1,
  "id": "pay_bill",
  "title": "Pay Electricity Bill",
  "utterances": [
    "help me pay this bill",
    "pay my electricity bill",
    "bijli ka bill bharna hai",
    "i want to pay the bill"
  ],
  "steps": [
    {
      "id": "amount",
      "resource_id": "amount_field",
      "instruction": "Enter the bill amount in this box.",
      "expects_value": true,
      "highlight": { "shape": "rect", "pulse": true }
    },
    {
      "id": "account",
      "resource_id": "account_field",
      "instruction": "Now type your account number here.",
      "expects_value": true,
      "highlight": { "shape": "rect", "pulse": true }
    },
    {
      "id": "submit",
      "resource_id": "submit_button",
      "instruction": "Tap this button to pay the bill.",
      "expects_value": false,
      "highlight": { "shape": "rect", "pulse": true }
    }
  ]
}
